{
  "contractId": "generate_video_v1",
  "version": "1.4.0",
  "toolName": "generate_video",
  "baseDescription": "generate_video produces text-to-video clips and Seedance multimodal reference videos.\nUse for text-only video generation with no source image input. For Seedance, also use this\ntool when uploaded/generated images, videos, or audio are loose references. Use animate_photo\nonly when a non-Seedance source image must become the first frame of an LTX/WAN animation.\n\nSEEDANCE UPLOADED STORYBOARD DEFAULT: When the user uploads a storyboard, shot sheet,\nmood board, or trailer concept image and asks to make a movie trailer/video/clip from it,\ndefault to one Seedance generate_video call with referenceImageIndices=[-1]. Do not first\nextract panels with edit_image, do not generate replacement keyframes, and do not make four\nseparate LTX animate_photo clips unless the user explicitly asks for separate clips or LTX.\nUse seedance2 when premium Spark access is available; if premium access is unavailable,\nexplain the limitation or use the best non-Seedance fallback the user accepts.\n\nSTORYTELLING / COMMERCIAL / TRAILER PROMPTS: For creative video requests, turn the brief\ninto timed, causally connected visual beats before writing the final prompt. Default social\nvideo is 15s 9:16 with a strong first 1-2s, visible escalation, payoff, and brand/CTA/final\nimage. Commercials should show audience desire/problem, transformation, proof/benefit, and\nCTA. Trailers should follow hook → world → disruption → escalation → reveal → title/CTA.\nEvery beat must be generatable: subject, setting, action, camera, lighting, audio, and text\nrole where relevant. Avoid vague \"cinematic\" filler, feature dumps, and beautiful images with\nno visible change.\n\nVIDEO PROMPT QUOTING: ONLY use double quotes for spoken dialogue in video prompts. Never\nquote on-screen text, titles, captions, or visual text elements — describe them without\nquotes. Quotes signal speech to the model and confuse audio generation.\n\nSTORYBOARD TEXT: Structural headings, section numbers, slide titles, panel titles, and\ncaptions in storyboard references may become short audio-only narration/VO or\nkey-message beats, but they are not subtitles, title cards, lower thirds, or visible\noverlays unless the user explicitly asks for visible text, on-screen text, a title\ncard, subtitle, lower third, signage, or CTA. Keep narration as separate brief phrases\nwith pauses; do not concatenate storyboard labels into run-on voiceover.\n\nDIALOGUE DURATION: Spoken dialogue must fit the clip. Estimate 2.5 words per second\nnatural delivery plus ~1s per acting beat. Hard maximum 3.75 words/second.\nCheck: dialogue words ÷ 2.5 + beats ≤ duration. Do not submit oversized dialogue.\n\nLATEST USER DURATION WINS: In follow-up turns, use the newest duration the user states,\neven if a previous assistant message mentioned a longer script/runtime. For example, if\nhistory says \"the full script is 66 seconds\" but the user now says \"do a 30 second version\",\ngenerate the 30 second version. Do not ask a clarification question just because history\ncontains another duration; treat the latest user request as the override.\n\nSEEDANCE DURATION LIMITS: Seedance 2.0 and Mini support 4-15s clips; Seedance 2.5 supports 4-30s clips. If the user explicitly asks\nfor Seedance below 4s, do not silently round up. Ask whether they prefer a 4s Seedance clip\nor an exact-duration LTX clip. If the user did not explicitly ask for Seedance, choose the\nmodel/tool that can satisfy the requested duration exactly.\n\nMINIMAX H3 TWO-STAGE OUTPUT: 1080p and 2K MiniMax H3 delivery is its own selector, not an option. \"minimax-h3-fasth3-t2v-turbo-2stage\" is the two-stage FastH3 engine: FastH3 renders the canvas, then the worker enlarges it 2x and refines it, so the clip is delivered at twice the canvas width and height with the same length and audio. targetResolution names the delivered class: 1080 renders a 544px short-edge canvas (960x544 becomes 1920x1088) for 10 Spark per second, 1440 or omitted renders the 768p canvas for 2K (1344x768 becomes 2688x1536) for 16 Spark per second, and 720 renders a 384px canvas (672x384 becomes 1344x768) for the regular FastH3 price of 4 Spark per second. The estimate prices every request. It takes the same prompt contract, durations and LoRAs as \"minimax-h3-fasth3-t2v-turbo\". Choose it when the user asks for 1080p, 1440p or 2K MiniMax H3 output, for two-stage output, or for the sharpest/best H3 quality; for ordinary 768p FastH3 output keep the regular FastH3 selector at targetResolution 768. The reference-to-video tiers have their own two-stage selectors: \"minimax-h3-r2v-2stage\" (Standard, 20 steps) and \"minimax-h3-r2v-balanced-2stage\" (Balanced, 8 steps) take exactly the references, prompt contract, durations and LoRAs of \"minimax-h3-r2v\" and \"minimax-h3-r2v-balanced\", deliver twice the canvas, and read targetResolution the same way (1080, 1440 or omitted for 2K, 720); each bills its tier's rate plus the two-stage surcharge of the delivered class. FastH3 Reference has one too: \"minimax-h3-fasth3-r2v-turbo-2stage\" is the two-stage form of \"minimax-h3-fasth3-r2v-turbo\" and reads targetResolution the same way. Choose one when the user asks for 1080p, 1440p or 2K MiniMax H3 reference-to-video output; keep the one-stage R2V selectors for ordinary 768p output. Never set 4K for H3.",
  "parameterDocs": {
    "prompt": "Video prompt. Use double quotes ONLY for spoken dialogue. Describe visual text without quotes.",
    "duration": "Clip duration in seconds. Plan dialogue word count against the 3.75 words/second ceiling.",
    "referenceVideoCompression": "Optional compression for one-stage MiniMax H3 Reference to Video (Standard, Balanced, LightX2V Turbo, or FastH3). Requires a video reference. Omit or use \"none\" to preserve normal behavior; use \"vpack\" only when the user explicitly chooses reference-video compression. It can reduce memory use but change fine detail and motion. It does not apply to two-stage output, other video models, or image-only references. Never silently enable it or remove it after a worker-capability refusal."
  }
}
