{
  "contractId": "replace_video_segment_v1",
  "version": "1.0.0",
  "toolName": "replace_video_segment",
  "baseDescription": "Use replace_video_segment when the user wants to regenerate a specific time range of an\nexisting video: \"regenerate from Xs to Ys\", \"redo the last N seconds\", \"swap out the middle\",\n\"fix the [start/middle/end] of the video\", or \"replace the [bumper/intro/outro/end card/\ntag/sting] at the [start/end] of the video\". Use explicit startSeconds and endSeconds; use\n-1 sentinels when exact base duration is unknown — the handler probes and resolves.\n\nWhen the replacement is already another uploaded or generated video clip, still use\nreplace_video_segment but pass replacementVideoIndex. Example: \"splice video 2 into video 1\nat 5s\" means videoIndex=-1, replacementVideoIndex=-2, startSeconds=5, endSeconds=5.\nUse endSeconds=startSeconds for insertion; use a wider endSeconds only when the user says to\nreplace/remove that base-video range. Do not use stitch_video for \"into the middle\"/\"insert\"\nrequests, because stitch_video only concatenates full clips end-to-end.\n\nFor time-sliced interleaving from existing videos — \"alternate 1s from each video\", \"weave\none-second clips from video 1 and video 2\", \"cut back and forth every N seconds\" — do NOT\nuse stitch_video and do NOT omit replacementVideoIndex. Start with the first requested video\nas the base, then call replace_video_segment once for each window that should come from the\nother video. Set replacementVideoIndex to that other existing video and set\nreplacementStartSeconds/replacementEndSeconds to the next source slice from that\nreplacement video. For ordinary\nalternation, preserve the base duration: set endSeconds=startSeconds+sliceDuration, not\nendSeconds=startSeconds insertion, unless the user explicitly asks to lengthen the output by\ninserting extra slices. Skip no-op windows that already come from the base video; only splice\nwindows that should come from a different source. Example for two 10s uploads alternating every 1s starting with video\n1: replace base windows 1..2, 3..4,\n5..6, 7..8, and 9..10 with slices 0..1, 1..2, 2..3, 3..4, and 4..5 from video 2. After\neach successful splice, target the newest composite video index for the next splice.\nThe -1 time sentinel applies only to base startSeconds/endSeconds when the base duration is\nunknown. Never use -1 for replacementStartSeconds or replacementEndSeconds; source windows\nmust use concrete non-negative seconds. For uploaded/generated videos with duration metadata,\nuse that known duration directly; do not call analyze_video just to learn the clip length for\nroutine alternating slices. Do not add a final tail splice with an unknown source end — stop at\nthe known clip duration or skip a no-op tail window.\n\nDo NOT call generate_video or animate_photo to re-render an existing video just to change\npart of it (the bumper, the intro, the end card, a single scene, the last few seconds, etc.).\nUse replace_video_segment — it preserves the unchanged portion, keeps the original audio\noutside the replaced window, and costs far less.\n\nAuto-detects the base video's model. New non-Seedance/WAN replacements default to LTX 2.5; use LTX 2.3 only for explicit rollback. OMIT videoModel unless the user explicitly demands a different model. Short requested windows are supported by rendering with model-specific handles and trimming the rendered clip before splicing, so still pass the user's exact startSeconds/endSeconds.",
  "parameterDocs": {
    "startSeconds": "Start of segment to replace in seconds. Use -1 sentinel if exact base duration is unknown.",
    "endSeconds": "End of segment to replace in seconds. Use the same value as startSeconds for insertion with replacementVideoIndex.",
    "replacementVideoIndex": "Existing uploaded/generated replacement clip. Use negative uploaded-video indices, e.g. -2 for the second uploaded video.",
    "replacementStartSeconds": "Optional start time inside replacementVideoIndex. Use with replacementEndSeconds for time-sliced interleaving. Must be concrete and >= 0; never use -1 here.",
    "replacementEndSeconds": "Optional end time inside replacementVideoIndex. Must be concrete, >= 0, and greater than replacementStartSeconds; never use -1 here.",
    "videoModel": "Omit to auto-detect from source. New non-Seedance/WAN replacements default to ltx25; use ltx23 only for explicit rollback."
  }
}
