{
  "contractId": "animate_photo_v1",
  "version": "1.1.0",
  "toolName": "animate_photo",
  "baseDescription": "animate_photo produces video from one or more source images using LTX 2.5 by default, with LTX 2.3 retained as a rollback path.\n\nVIDEO PROMPT QUOTING: In video prompts, ONLY use double quotes for spoken dialogue.\nSpeaker tags are allowed outside the quotes for screenplay-style dialogue, e.g.\nCHARACTER: \"We made it.\" Never put on-screen text, overlay text, titles, captions, signs,\nwatermarks, or any visual text in quotes — describe them without quotes (e.g. bold white text\nreading CONGRATULATIONS overlays the lower third). Quotes signal speech to the model;\nquoting non-speech text confuses audio generation.\n\nDIALOGUE DURATION: Spoken dialogue in video prompts must fit the clip duration. Estimate\nat 2.5 words per second for natural cinematic delivery, plus ~1 second per acting beat\n(pauses, gestures, glances between lines). If the user did NOT explicitly request a specific\nduration (using default 5s), extend the duration to fit the dialogue (max 20s). If the user\nexplicitly requested a specific duration, condense the dialogue to fit while preserving meaning.\nAlways check: total dialogue words ÷ 2.5 + beat count ≤ clip duration.\n\nLATEST GENERATED IMAGE FOLLOW-UP: When the newest user turn asks to animate, make a video,\nor make a clip from a generated image/result (for example \"the apple\", \"this one\",\n\"the latest image\"), use animate_photo with that latest generated image. Do not inherit an\nolder Seedance model, resolution, or duration from an unrelated prior turn unless the newest\nuser turn explicitly says Seedance or confirms an immediately suggested Seedance video stage.\nLTX supports exact 2-20s durations, so honor requests like 3s exactly.\n\nWORD BUDGET PER CLIP: The handler REJECTS clips whose spoken dialogue exceeds the budget\n— there is NO auto-trim, so plan dialogue lengths up-front. Hard maximum is 3.75 spoken\nwords per second. Ceilings: 5s = 18 words, 6s = 22 words, 8s = 30 words, 10s = 37 words,\n15s = 56 words, 20s = 75 words. Aim below these ceilings. If a scene's dialogue won't fit,\ntighten the lines, raise the per-clip duration, or split into two segments — do NOT submit\nand hope it works. Spoken words inside double quotes count toward the budget; speaker tags\nand visual/action prose are free.\n\nBATCH VIDEO PER-CLIP DURATION: For a multi-segment animate_photo batch\n(sourceImageIndices + prompts) when the user states a TOTAL video length but NO per-clip\nlength, target 15 seconds per clip when dialogue is involved, and pass that duration\nexplicitly. Example: 60s total → 4 segments × 15s, NOT 6×10s or 12×5s. There is NO 3-clip\nbatch cap: sourceImageIndices supports up to 16 clips, so never split one planned batch into\n\"first 3\" and \"remaining clips\" calls. Do NOT split a planned 15s dialogue scene into multiple\nshorter clips just because a retry complains about word budget; keep duration=15 and tighten\nthe line. Use 5s clips only for single short motion beats or one very short spoken phrase.\nIf the user explicitly specifies a per-clip duration, honor that instead.\n\nN-VERSIONS-OF-A-VIDEO PATTERN: NEVER call animate_photo N times sequentially — ALWAYS\nuse sourceImageIndices in ONE call so all N projects run in parallel. Two flavors:\n(A) SHARED CONTENT — one edit_image/generate_image call with numberOfVariations=N + {|}\nDynamic Prompts to make N distinct source images, then ONE animate_photo call with\nsourceImageIndices=[start..start+N-1] and a single shared prompt.\n(B) PER-CLIP CONTENT — when each clip has DIFFERENT dialogue, jokes, narration, or motion,\npass BOTH sourceImageIndices AND prompts (array of N strings, one per clip) in the SAME\nsingle animate_photo call. The top-level prompt is still required — pass a brief batch summary.\n\nCRITICAL: sourceImageIndices values MUST be read from the latest edit_image/generate_image\ntool result's startIndex field — if startIndex=3 and 4 images were generated, pass\nsourceImageIndices=[3,4,5,6], NOT [0,1,2,3]. Negative indices refer to uploaded images:\n-1 first upload, -2 second upload, -3 third upload. Use repeated -1 entries only when\nintentionally reusing the primary uploaded image. When prompts is supplied, prompts.length\nMUST equal sourceImageIndices.length.\n\nSEEDANCE UPLOADED STORYBOARD DEFAULT: If the user uploaded a storyboard, shot sheet,\nor visual trailer board and asks to make a trailer/video/movie/clip from it, do NOT use\nanimate_photo on the board image and do NOT split it into four LTX clips. Use generate_video\nwith Seedance referenceImageIndices for one continuous clip unless the user explicitly asks\nfor separate LTX clips or first-frame/last-frame animation.\n\nSCREENPLAY / STORYBOARD ANIMATE RULE: For full storyboard projects, use one\nanimate_photo batch with sourceImageIndices + prompts so each clip keeps its own exact\nscene text, stable cast anchors, and screenplay-style speaker-tagged dialogue, and all video\nclips render in parallel. Every speaking clip's video prompt must include that clip's actual\nquoted dialogue, not placeholders such as \"while speaking\", \"dialogue begins\", \"explaining\",\nor \"final line lands\". If each generated scene keyframe should be both the first and last frame\nof its own stitched segment, call animate_photo with sourceImageIndices=[start..end],\nframeRole=\"both\", prompts=[...], and OMIT endImageIndex/endImageIndices so the handler\nuses each source as its own end frame.\n\nUPLOADED REFERENCE LOOPED SKITS: When the user supplies one uploaded reference image and\nasks for several scripted/storyboard/dialogue segments to reuse that same image as BOTH the\nfirst frame and last frame of each segment before stitching, do it in ONE animate_photo call:\nsourceImageIndices=[-1,-1,...], frameRole=\"both\", endImageIndex=-1 (or matching\nendImageIndices=[-1,-1,...]), duration equal to the requested per-segment duration, and\nprompts=[one full scene prompt per segment]. Each prompt must preserve the exact screenplay\nspeaker tags and quoted dialogue from that scene, e.g. HOST: \"...\" GUEST: \"...\". Do not\ndrop speaker tags, convert them to generic narration, omit the last-frame contract, analyze\nthe image first, generate new keyframes first, or split the batch into serial calls. After\nthe single animate_photo batch completes, call stitch_video with the returned video indices.\n\nFor adjacent transition chains: N images create N-1 clips — call animate_photo with\nframeRole=\"both\", sourceImageIndices=[start..end-1], endImageIndices=[start+1..end],\nprompts=[one transition prompt per adjacent pair], then stitch_video. If 5 uploaded images\nare the keyframe sequence, use sourceImageIndices=[-1,-2,-3,-4],\nendImageIndices=[-2,-3,-4,-5], frameRole=\"both\", prompts length 4, then stitch_video.\nDo NOT set endImageIndex=-1 in generated-keyframe patterns — that means every clip ends\non the primary uploaded image.\n\nUPLOADED FIRST-FRAME/LAST-FRAME TRANSITION CHAINS: If the user uploads multiple images\nand asks for a video that transitions from image to image, changes country/version every\nN seconds, or says to use first-frame/last-frame for each pair, call animate_photo directly.\nDo not call edit_image, generate_image, analyze_image, or map_assets_for_model first — the\nuploaded images are already the keyframes. For N uploaded images, create N-1 adjacent clips\nunless the user explicitly asks for a loop back to the first image. Use per-clip duration\nfrom \"every N seconds\" when present; otherwise divide the requested total by the number of\nadjacent clips. After animate_photo returns the batch videos, always call stitch_video with\nthose video indices before finalizing.\n\nMINIMAX H3 2K OUTPUT: outputScale=2 is available only on the MiniMax H3 selectors. It renders on the normal H3 canvas and delivers the clip at twice its width and height (1344x768 becomes 2688x1536) with the same length and audio, for +10 Spark per second (+6 at 480p). Set outputScale=2 only when the user asks for 2K, 1440p-class or extra-sharp H3 output; keep targetResolution at 768 or omit it, never set 1080p, 1440p or 4K for H3, and leave outputScale unset otherwise. Do not set it for any other model.",
  "parameterDocs": {
    "sourceImageIndices": "Batch source image indices. Read startIndex from prior generate_image/edit_image result. Negative = uploaded images (-1 = first upload).",
    "prompts": "Per-clip prompt array. Length MUST equal sourceImageIndices.length when both are set.",
    "duration": "Per-clip duration in seconds. Target 15s when dialogue is involved and total length is given without per-clip spec.",
    "frameRole": "Set to \"both\" for first+last frame transitions using sourceImageIndices + endImageIndices.",
    "endImageIndices": "End frames for adjacent-chain transitions. N images → N-1 clips.",
    "outputScale": "MiniMax H3 only: 2 = 2K delivery (twice the width and height, same length and audio, +10 Spark/s, +6 at 480p). Set only when the user asks for 2K, 1440p-class or extra-sharp H3 output; otherwise omit."
  }
}
