{
  "contractId": "edit_image_v1",
  "version": "1.2.0",
  "toolName": "edit_image",
  "baseDescription": "edit_image applies instruction-based edits to uploaded or generated images. Use when\nuploaded or reference images must guide identity or likeness.\n\nImage-to-Image prompt order: [IDENTITY LOCK] → [REQUESTED EDIT] → [REFERENCE ROLE\nMAPPING] → [POSE/COMPOSITION] → [STYLE] → [LIGHTING/REALISM] → [PRESERVE ALL\nUNMENTIONED DETAILS]. GOLDEN RULE: When editing a person, always state which image owns\nidentity — never leave identity ambiguous. Describe only the DELTA — what changes. Don't\nrewrite the entire image; the base image already contains most of the truth. Default to minimal\nchange. For multi-image edits, assign ONE primary role per reference image (identity, pose,\noutfit, style, environment). Never let a style/pose/clothing reference silently override the face.\nUse positive constraints — \"preserve exact facial likeness, face structure, eye shape, nose\nshape, mouth shape, jawline, skin tone, hairline, apparent age, and overall recognizability\"\n— not vague negatives like \"don't mess up the face\".\n\nUPLOADED IMAGE VARIANT SETS: When the user supplies a photo/portrait/reference image and\nasks for N distinct generated images deriving from that source while changing paired\nper-output details, call edit_image exactly once with sourceImageIndex=-1,\nnumberOfVariations=N, and ONE Dynamic Prompt branch with N complete options. Each option\nmust be a full concrete image prompt for one output, including the uploaded subject/reference\nanchor, requested pose or placement preservation, the specific changed appearance/style/role,\nclothing or surface details when relevant, setting/background, and any requested label text or\nvisual symbol. If one option is a remade original/preserved source and the rest are themed\nvariants, the original option must explicitly say to preserve the original clothing/wardrobe/outfit\nand background/setting, plus any requested added label, flag, logo, symbol, or prop.\nDo not call generate_image, analyze_image, or multiple serial edit_image calls first.\n\nSELECTION-GATED IMAGE STAGES: If the user asks for N image options and says they will pick\none before a later dance/video/animation, call edit_image exactly once with numberOfVariations=N\nand one Dynamic Prompt branch. After images are created, stop and ask the user to choose;\ndo not call dance_montage, animate_photo, or generate_video until they select.\n\nMULTI-PERSONA (COMBINED): When multiple personas must appear in the SAME scene, make\nONE edit_image call with ALL persona faces in one prompt and DO NOT pass personaName.\nPer-persona splits (one call each with personaName set) are RARE — only when the user\nexplicitly asks for solo images of each person individually.\n\nSTORYBOARD IMAGE BATCH RULE: When rendering scene keyframes from a screenplay/storyboard,\nnumberOfVariations is only the count; the prompt MUST be one Dynamic Prompt branch with one\nfull keyframe prompt per scene:\n{scene 1 full keyframe prompt|scene 2 full keyframe prompt|...|scene N full keyframe prompt}.\nNEVER set numberOfVariations=N with only the first scene prompt — that creates N versions of\nscene 1. For full project requests, one edit_image batch for all scene keyframes, then one\nanimate_photo batch for all video clips in parallel.\nException: if the storyboard/shot sheet is already uploaded and the user asks to make a\ntrailer/video/movie/clip from that uploaded board, do not extract panels or redraw keyframes.\nUse generate_video with Seedance references for one continuous clip unless the user explicitly\nasks for separate image keyframes or a storyboard sheet output.\n\nDIRECT UPLOADED GPT IMAGE STORYBOARD SHEETS: If the user uploaded reference images and\nasks for one finished GPT Image storyboard/keyframe sheet now, call edit_image directly\nwith sourceImageIndex=-1, model=\"gpt-image-2.5-sunburst\", numberOfVariations=1, and the requested\ncanvas/aspect settings. Preserve another explicit GPT Image model named by the user.\nIf the user did not explicitly specify a storyboard page/canvas/sheet\nshape, default the GPT Image 2 storyboard sheet pixel dimensions to a balanced grid that hosts\nthe target cell aspect ratio natively (e.g., 12 cells with 9:16 portrait video target -> ~3:4\nportrait sheet around 1728x2304; 12 cells with 16:9 landscape video target -> ~4:3 landscape\nsheet around 2304x1728; 6 cells with 9:16 target -> ~27:32 portrait sheet around 1840x2176). Do\nNOT default the sheet to 2560x1440 landscape when cells are portrait — a landscape sheet with\na portrait-cell grid physically forces cells to ~4:3 landscape and the model will not render\n9:16 portrait rectangles inside it. Keep individual scene-cell/frame areas at the target video\naspect ratio. Do not call map_assets_for_model, analyze_image, generate_image, or a separate\nplanning tool first. The uploaded files are already available as references; describe their\nroles plainly in the edit_image prompt and generate the sheet in that call.\n\nDO NOT USE edit_image FOR UPLOADED REFERENCE LOOPED VIDEO SEGMENTS: If the user says the\nsame uploaded image/reference should be reused as the first frame and last frame of each\nscripted segment/scene/clip before stitching, they are explicitly asking to animate the\nuploaded image, not to generate new storyboard keyframes. Do not call edit_image for that\nrequest. Call animate_photo once with repeated uploaded source indices and per-scene prompts.\n\nKREA IDENTITY EDIT: Use model=\"krea-identity-edit\" whenever an edit of a referenced person or character must keep likeness or character identity while changing clothing, hair or makeup, pose or position, face/head/body, background, lighting, or visual style. Infer that semantic intent in any language; never route from keyword or regex matching. Also use it for a non-Pro single-character sheet. This default applies even when the user did not name Krea; an explicitly requested model always wins. Use model=\"dark-beast-krea2-identity-edit\" only when the user explicitly requests that model, its uncensored/community variant, or dark_beast_krea2_identity_edit_v1_2. These models require one reference image, accept up to two context images, and work best at 512-2048 px. Let the current model tier and worker choose steps, guidance, sampler, scheduler, grounding, and reference-boost defaults; do not send a negative prompt. Put the primary scene/base image first and an optional person/detail reference second. Write a concise 1-4 sentence delta instruction rather than restating the whole image; reference context_image_0 and context_image_1 when model_ref tokens are needed.\n\nFLUX 3 IMAGE KLEIN: Use model=\"flux-3-klein\" when the user asks for FLUX 3 or FLUX 3 Image Klein. It accepts 1-6 reference images and works at 256-2048 px. Guidance is fixed and a negative prompt has no effect, so do not send one. Unlike the Krea delta instruction, describe the whole result as a full scene caption (subject, framing, background, lighting) that folds the requested change into a description of the reference, and refer to references in order as the first image, the second image, and so on.\n\nGPT Image 2.5 adds two distinct models: use \"gpt-image-2.5-sunburst\" for an explicit Sunburst request and \"gpt-image-2.5-flare\" for an explicit Flare request. For GPT Image 2.5 without a named variant, use Flare. Preserve explicit GPT Image 2.0 as \"gpt-image-2\". Sunburst is positioned for difficult images and precise edits; Flare for faster everyday generation. Both generate and edit. Model choice is independent of rendering quality.",
  "parameterDocs": {
    "sourceImageIndex": "Index of uploaded/generated image. Use -1 for the first uploaded image.",
    "numberOfVariations": "Number of output variants. When > 1, use a Dynamic Prompt branch with one complete prompt per output.",
    "prompt": "Edit instruction. Start with identity lock (who owns the face), then describe only the delta."
  }
}
