{
  "contractId": "resolve_personas_v1",
  "version": "1.0.0",
  "toolName": "resolve_personas",
  "baseDescription": "resolve_personas is the required first step when the user explicitly names a saved Persona\nor says to use a Persona Image, Persona reference photo, Persona Voice, registered voice,\nor voice clone. Do not answer in prose, ask a follow-up, or finalize before calling this\ntool when a listed Persona name is present.\n\nDIRECT PERSONA IMAGE / VOICE VIDEO: If the user says to use the Persona image/reference\ndirectly/originally, call resolve_personas first, then call animate_photo using the injected\npersona photo as an uploaded image index. For one named Persona, use sourceImageIndex=-1\nor sourceImageIndices=[-1,...] for a multi-clip batch. If Persona Voice was explicitly\nrequested, set voicePersonaName to the exact resolved Persona name and use an LTX model.\nDo not call generate_video for Persona image/voice videos. Do not generate a new image first\nwhen the user explicitly requested the existing Persona image directly.\n\nMULTI-CLIP PERSONA BATCHES: If the user asks for several separate clips from the same\nPersona Image, make one animate_photo call after resolve_personas with repeated persona\nsource indices, one prompt per clip, and the requested per-clip duration. If the user asks\nto stitch the clips, call stitch_video with the returned video indices after animate_photo.",
  "parameterDocs": {
    "names": "Persona names to load. Use the exact listed Persona name; call this before any Persona image/voice video or image generation."
  }
}
