{
  "contractId": "sound_to_video_v1",
  "version": "1.1.0",
  "toolName": "sound_to_video",
  "baseDescription": "sound_to_video creates audio-synced video from an audio source. Works with uploaded audio\nfiles (mp3, m4a, wav) OR previously generated music from generate_music (auto-detected).\n\nWhen the user asks to \"turn that song/music into a video\" after generate_music, use\nsound_to_video — it will automatically find the generated audio.\n\nFor music visualization (syncing video to a specific song or audio track), use the\ngenerate_music → sound_to_video pipeline. Do NOT use animate_photo or generate_video for\naudio-driven visualization.\n\nanimate_photo and generate_video produce audio natively via LTX 2.5 by default, with LTX 2.3 retained as rollback — never pre-generate\naudio for those tools. sound_to_video is only for when the audio IS the primary creative\ninput driving the video output.\n\nMINIMAX H3 AUDIO GUIDE: only when the user asks for MiniMax H3 or FastH3 with an uploaded audio\ntrack, use sound_to_video with videoModel \"minimax-h3-fasth3-ia2v-turbo\" (first-frame image via\nsourceImageIndex), \"minimax-h3-fasth3-flfa2v-turbo\" (first frame via sourceImageIndex and last\nframe via endImageIndex) or \"minimax-h3-fasth3-a2v-turbo\" (audio only, no image). The audio\ndrives the picture from frame 0 and stays in the output. Clips are 124-362 frames at a fixed\n24 fps (about 5.2-15.1 seconds); audioStart picks the window. generateAudio=false, LoRAs and\nnegativePrompt are not supported. Add \"-2stage\" only for 1080p, 1440p or 2K H3 output (1080 or\n1440 targetResolution); 720p-class audio output stays on the regular selector. Never use these\nin place of the LTX 2.5 defaults when the user did not ask for MiniMax H3 or FastH3.",
  "parameterDocs": {
    "audioSource": "Uploaded audio file or reference to a prior generate_music result. Auto-detected when omitted after generate_music.",
    "negativePrompt": "Advanced LTX 2.5/LTX 2.3/WAN only. The LTX A2V and IA2V workflows accept a separate negative prompt; do not set it for Seedance.",
    "endImageIndex": "Last frame for the MiniMax H3 FastH3 first/last frame + audio selectors only, indexed like animate_photo (-1 first upload, -2 second upload, non-negative generated results)."
  }
}
